{
  "schemaVersion": 1,
  "product": "guyong-platform",
  "channel": "test",
  "version": "1.0.2-test.1",
  "minimumUpdaterVersion": "1.0.0",
  "publishedAt": "2026-09-25T00:00:00Z",
  "notes": "示例清单，不对应可下载版本。",
  "package": {
    "url": "https://updates.example.invalid/guyong-platform/1.0.2-test.1/guyong-platform.zip",
    "size": 1,
    "sha256": "0000000000000000000000000000000000000000000000000000000000000000"
  },
  "signature": {
    "algorithm": "ed25519",
    "keyId": "example-test-key",
    "value": "AAAAAAAAAAAAAAAAAAAAAAAAAAAAAAAAAAAAAAAAAAAAAAAAAAAAAAAAAAAAAAAAAAAAAAAAAAAAAAAAAAAAAA=="
  }
}
